<?xml version="1.0" encoding="UTF-8" ?>
<xs:schema xmlns:xs="http://www.w3.org/2001/XMLSchema">

<xs:element name="pedido">
  <xs:complexType>
    <xs:sequence>
      <xs:element name="cliente" type="xs:string"/>
      <xs:element name="destino">
        <xs:complexType>
          <xs:sequence>
            <xs:element name="nome" type="xs:string"/>
            <xs:element name="endereco" type="xs:string"/>
            <xs:element name="cidade" type="xs:string"/>
          </xs:sequence>
        </xs:complexType>
      </xs:element>
      <xs:element name="item" maxOccurs="unbounded">
        <xs:complexType>
          <xs:sequence>
            <xs:element name="produto" type="xs:string"/>
            <xs:element name="quantidade" type="xs:positiveInteger"/>
            <xs:element name="preco" type="xs:decimal"/>
          </xs:sequence>
        </xs:complexType>
      </xs:element>
    </xs:sequence>
    <xs:attribute name="id" type="xs:string" use="required"/>
  </xs:complexType>
</xs:element>

</xs:schema>